<trainer xmlns="https://paulwardrip.github.io/xmlschema.js/demo/pokemon"
         xmlns:s="https://paulwardrip.github.io/xmlschema.js/demo/pokemon/stats"
         xmlns:xsi="http://www.w3.org/2001/XMLSchema-instance"
         xsi:schemaLocation="https://paulwardrip.github.io/xmlschema.js/demo/pokemon
            pokemon.xsd">

    <pokeball inventory="2" />
    <potion inventory="1" />
    <revive inventory="3" />

    <team>
        <!-- valid pokemon -->
        <pokemon id="1" level="4" hp="100">
            <name>Bulbasaur</name>
            <type>poison</type>
            <type>grass</type>
            <stats>
                <s:hp></s:hp>
                <s:defense></s:defense>
                <s:sp-defense></s:sp-defense>
                <s:attack></s:attack>
                <s:sp-attack></s:sp-attack>
            </stats>
        </pokemon>

        <!-- invalid pokemon -->
        <pokemon id="1">
            <name>Bulbasaur1</name>
            <type>poison</type>
            <type>grass</type>
            <type>watur</type>
            <stats>
            </stats>
        </pokemon>
    </team>
</trainer>